question,document
Do I have to commit my changes before I close or delete the codespace to preserve them?,1e829a8c6f
Will the heavy vector‑search dependencies stay in my main environment if I use the same codespace?,1e829a8c6f
Why does download.py freeze at 0% when pulling model.onnx from HuggingFace?,29b69fbe0b
What causes the download script to get stuck during the model download?,29b69fbe0b
How can I avoid download.py hanging while fetching the ONNX model?,29b69fbe0b
Where can I manually retrieve the model.onnx file to skip the slow download?,29b69fbe0b
Is there a workaround if my connection to HuggingFace's CDN is slow during download.py execution?,29b69fbe0b
Why are the scores from X.dot(v_query) and the for-loop implementation not identical?,e889793af9
What causes the slight differences between matrix multiplication and the for-loop in vector search?,e889793af9
Is floating-point precision the reason the two methods give different results?,e889793af9
How can I verify that the results are effectively the same?,e889793af9
Why does BLAS sum in a different order than a Python loop?,e889793af9
I get a list index out of range error when I try to get the best chunk – what's going wrong?,1a7b27c4df
Why does accessing the best chunk raise an IndexError in my vector search?,1a7b27c4df
Could a mismatch between embeddings and chunks cause the list index out of range error I'm seeing?,1a7b27c4df
How can I ensure the number of embeddings matches the number of document chunks to avoid that error?,1a7b27c4df
What steps should I take if my best chunk lookup fails with a list index out of range exception?,1a7b27c4df
Why doesn't my cosine similarity answer match any of the provided options?,eaa17a9dc6
Am I using the wrong embedding model for the homework?,eaa17a9dc6
What should I embed when computing similarity – the file name or the content?,eaa17a9dc6
Do I need to normalize vectors before calculating the dot product?,eaa17a9dc6
"If my result is close but not exact, what should I do?",eaa17a9dc6
How do I set up my Gemini API key for Kestra?,3860e5fe8b
"Do I need to base64‑encode my OpenAI key, and how?",3860e5fe8b
Which environment variable names does Kestra look for when using the AI Copilot?,3860e5fe8b
When should I run `docker compose up` after setting my secrets?,3860e5fe8b
"In a flow, how do I reference a secret without the `SECRET_` prefix?",3860e5fe8b
How do I fix the Kestra AI Copilot error that says it can only assist with creating flows?,04440cab11
What should I do if the Copilot keeps refusing to help with anything else?,04440cab11
How can I properly set the Gemini API key so the Copilot works?,04440cab11
Why is the Copilot refusing even when I have a key?,04440cab11
What should I do if I receive a 429 Resource Exhausted error with the Copilot?,04440cab11
How can I fix my Kestra flow that still reports an invalid or missing key after setting SECRET_GEMINI_API_KEY?,c8ca21af33
Is a trailing space or newline in my base64-encoded GEMINI_API_KEY the reason Kestra authentication keeps failing?,c8ca21af33
"Do I need to restart Kestra after exporting my GEMINI_API_KEY, and what is the proper command to do it?",c8ca21af33
What is the correct way to reference the GEMINI_API_KEY secret inside a Kestra flow without the SECRET_ prefix?,c8ca21af33
Would placing my API keys in a .env file and running docker compose with --env-file help resolve the key issue?,c8ca21af33
What makes Kestra necessary if I can just run code in a notebook?,193612db63
How does orchestration help with scheduling and retries in AI workflows?,193612db63
Can I use Kestra to manage secrets and monitoring for my AI projects?,193612db63
Why would I want to swap AI providers in a flow without changing code?,193612db63
"How does Kestra integrate with AI Copilot, RAG, and agents in this course?",193612db63
Can I use Airflow instead of Kestra for my capstone project?,cce328db64
Is Kestra required for the entire course or only Module 3?,cce328db64
What happens if I skip learning Kestra in Module 3?,cce328db64
How do I switch AI providers in a Kestra flow?,cce328db64
Will using a plain Python script instead of an orchestrator affect my capstone score?,cce328db64
Which AI services can I use with Kestra besides Gemini?,f442efe5b4
Is it possible to work with Groq or Ollama models inside Kestra?,f442efe5b4
How do I set up a local model with Kestra’s AI plugin?,f442efe5b4
When should I pick the generic AI plugin over a vendor‑specific one?,f442efe5b4
How do I point the OpenAI plugin to another compatible provider like DeepSeek or xAI?,f442efe5b4
"Is Kestra truly no-code, or do I still need to write YAML?",bfe5502c30
How does the form editor work in Kestra – can I just fill fields?,bfe5502c30
Can I generate workflows with natural language using the AI Copilot?,bfe5502c30
Are there other ways to create flows without using the Kestra UI?,bfe5502c30
How does Kestra compare to tools like Zapier or n8n for simple automations?,bfe5502c30
How can I ensure the Kestra flow YAML generated by a generic AI actually aligns with my running plugin version?,93a3e8b98c
What should I do if the AI proposes properties such as bucket or name that don't exist in the GCS Upload plugin?,93a3e8b98c
"If my AI-generated flow splits the table reference into projectId, dataset, and table fields, how do I consolidate it into a single destinationTable?",93a3e8b98c
Where can I verify the correct property names for Kestra GCP plugins to cross-check AI-generated YAML?,93a3e8b98c
Is there a built-in Kestra AI copilot feature that can generate flow YAML grounded in my current plugin schema?,93a3e8b98c
How does monitoring token usage help me control my AI costs in Kestra?,a4adc70f41
Where can I view the token counts for each LLM call in my workflow?,a4adc70f41
Can I set up alerts if a task uses too many tokens?,a4adc70f41
What happens if a workflow loop keeps consuming tokens without limit?,a4adc70f41
Does tracking tokens help me optimize my prompts and reduce waste?,a4adc70f41
What causes the 'mounts denied' Docker error when using Kestra?,dd8b4c9fda
How can I add a host directory to Docker Desktop's file sharing list?,dd8b4c9fda
Which settings do I need to modify in Docker Desktop to resolve the path sharing issue?,dd8b4c9fda
Do I need to restart Docker after updating file sharing settings?,dd8b4c9fda
What command should I run after fixing the file sharing to start Kestra?,dd8b4c9fda
Which files from my Kestra work should I commit to the public repo?,f29f622684
Do I need to add a README file to my repository for the Module 3 submission?,f29f622684
"If my Kestra flows use custom scripts, how should I include those scripts in my repo?",f29f622684
"Is it okay to only upload the flow YAML files, or do I need to include the whole folder structure?",f29f622684
Do I submit my answers to the form questions inside the repo or just in the submission form?,f29f622684
Why does the LLM sometimes wrap the JSON in a code fence and I get a JSONDecodeError?,a3c7e1b4f9
How can I force the LLM to return pure JSON instead of markdown?,a3c7e1b4f9
What exact prompt wording ensures the response is only the JSON object with 5 questions?,a3c7e1b4f9
Does the response_format parameter work across all providers like Gemini and Groq?,a3c7e1b4f9
"If the LLM still includes prose around the JSON, what’s the best way to handle it in my code?",a3c7e1b4f9
Why does my Jupyter kernel crash when I embed the ground-truth set?,b8f2d6a30c
What memory issues cause the crash and how can I avoid them?,b8f2d6a30c
Can I use a smaller embedding model to reduce RAM consumption?,b8f2d6a30c
How do I run the embedding step in a separate script and load the vectors back?,b8f2d6a30c
What machine settings or batch processing steps can help keep the kernel alive?,b8f2d6a30c
Why does my dataset generation keep hitting rate limits?,c1e9f4b820
How can I prevent per‑minute and per‑day Gemini quota hits?,c1e9f4b820
What inexpensive options exist to generate the entire ground‑truth set?,c1e9f4b820
Should I lower thread‑pool workers to avoid quota issues?,c1e9f4b820
How can I resume dataset creation after a limit breach?,c1e9f4b820
How do I resolve WinError 126 when running PyTorch on Windows?,15e931476c
What causes the fbgemm.dll not found error in PyTorch?,15e931476c
Which Visual C++ components do I need to install for PyTorch?,15e931476c
Do I need Visual Studio or just the redistributable to fix this?,15e931476c
Where can I learn more about this PyTorch DLL error?,15e931476c
Why does my prep.py run into an error about the postgres host?,4b65d5542d
What changes do I need to make in the .env file to fix the host issue?,4b65d5542d
"If I see 'No such host is known', what should POSTGRES_HOST be set to?",4b65d5542d
Where exactly is the .env file located in this project?,4b65d5542d
"After updating POSTGRES_HOST to localhost, how do I verify the problem is resolved?",4b65d5542d
How can I make Pandas show the full text in a column instead of truncating?,641aedbbf5
"What Python code sets pd.set_option('display.max_colwidth', None) to show complete column content?",641aedbbf5
Why does Pandas default to truncating column text after 50 characters?,641aedbbf5
Where can I find official documentation on Pandas display options?,641aedbbf5
Is there a way to view the entire Explanation column in the offline‑rag‑evaluation notebook?,641aedbbf5
What is the most straightforward method to normalize a column of vectors in a pandas DataFrame?,5039707c1a
How can I apply a normalization function to every vector inside a pandas Series?,5039707c1a
Is it possible to use a lambda function to divide each vector by its L2 norm in pandas?,5039707c1a
What is a quick way to add a new column with normalized vectors to an existing DataFrame?,5039707c1a
Are there alternative libraries or functions that simplify vector normalization in pandas?,5039707c1a
What's the best way to get the 90th percentile of a column in pandas?,b4c8ac5a0c
How do I calculate a percentile on a Series in pandas?,b4c8ac5a0c
Can I get the 75% quantile of a dataframe column easily?,b4c8ac5a0c
Is there a pandas function to compute quantiles for a column?,b4c8ac5a0c
How can I use pandas to find the 95th percentile of my data?,b4c8ac5a0c
How do I remove every Docker container on my computer from the command line?,66ccbb7da0
Which single command will delete all Docker images at once?,66ccbb7da0
What is the quickest way to clear all Docker volumes with one terminal command?,66ccbb7da0
Can I force removal of running containers using a single Docker command?,66ccbb7da0
"Is there a one‑liner that wipes containers, images, and volumes together?",66ccbb7da0
How can I restrict the feedback buttons to only be usable once per submission in my Streamlit app?,2e729f1271
What is causing st.session.submitted to reset to True after I press a feedback button?,2e729f1271
Is there a way to disable the +1/-1 buttons until the ask button has been used?,2e729f1271
Why does the session state attribute get reassigned even though a feedback button was clicked?,2e729f1271
Can someone explain the solution for the feedback button being enabled after submission in Streamlit?,2e729f1271
"I'm getting an 'executable file not found' error when I try to run my Streamlit app with docker-compose, but it works fine on my host. What could be wrong?",e8df9f0d12
How do I make sure the streamlit binary is present in my Docker container when using compose?,e8df9f0d12
My compose file throws 'exec: streamlit: unknown' when starting the app. What do I need to add or change?,e8df9f0d12
"If Streamlit runs outside Docker but not inside compose, what's usually the issue?",e8df9f0d12
"Once I've added streamlit to my compose config, what command rebuilds everything so it starts correctly?",e8df9f0d12
Can I work on the capstone with a partner or team?,0fab61eca2
Is collaboration allowed if I submit my own project?,0fab61eca2
Do we need separate repositories for each team member?,0fab61eca2
What happens if our project can’t be evaluated independently?,0fab61eca2
How does the course handle shared systems among students?,0fab61eca2
Can I submit two projects?,d5fc98925d
What happens if my first submission fails?,d5fc98925d
Do I need to re‑submit for attempt 2?,d5fc98925d
Can I use the same dataset for both attempts?,d5fc98925d
Does not doing peer‑review affect certification?,d5fc98925d
Can I submit the Kaggle competition entry as my capstone project?,e892d44e42
Are teams allowed for the math-kaggle-llm-competition?,e892d44e42
Will participating in the competition replace the individual capstone requirement?,e892d44e42
What is the difference between the capstone project and the competition?,e892d44e42
Is the competition considered part of the course assessment?,e892d44e42
How will my capstone project be graded?,9a2e2d2008
Who will evaluate my project?,9a2e2d2008
What happens if I don't grade others' projects?,9a2e2d2008
How is the final score determined?,9a2e2d2008
What are the peer review guidelines I need to follow?,9a2e2d2008
When will the Excel sheet with project assignments be shared after we finish our submissions?,eae0fb50aa
"Will every student always be assigned three projects, or can it vary?",eae0fb50aa
How does the assignment process decide which projects each person receives?,eae0fb50aa
"If I submit after the deadline, will I still get a project to review?",eae0fb50aa
Can I swap projects with someone else after the assignments are posted?,eae0fb50aa
"I've already submitted my capstone, but I can't see any projects to review. What's happening?",a8a7fef016
Why am I not able to choose which projects I evaluate after my submission?,a8a7fef016
When will the instructor release the list of projects I need to review?,a8a7fef016
Is it possible to review projects before the deadline is over?,a8a7fef016
"If I submitted early, can I still review other projects later?",a8a7fef016
Where can I browse ideas for the capstone project?,e76a70cde3
Do you recommend any datasets for the LLM capstone?,e76a70cde3
Is there a GitHub repo with project examples?,e76a70cde3
What tips are provided for choosing a project?,e76a70cde3
Where can I find guidelines for the project?,e76a70cde3
Is a plain Python script sufficient to satisfy the ingestion pipeline requirement for my capstone?,d4f7c08ea1
Do I have to use an orchestrator like Airflow or Kestra to earn full points?,d4f7c08ea1
Will using a Jupyter notebook instead of a script reduce my ingestion points?,d4f7c08ea1
When is it justified to include an orchestrator in my capstone project?,d4f7c08ea1
What are the benefits of adding an orchestrator only if it truly fits my data ingestion needs?,d4f7c08ea1
How can I create synthetic queries to test my RAG model when I don't have real Q&A pairs?,9b0e2d6a47
What metrics should I use to evaluate a retrieval‑augmented generation system if there's no clear ground truth?,9b0e2d6a47
"Can I rely on an LLM to judge the quality of my RAG outputs, and how do I set up the prompt?",9b0e2d6a47
Which ranking metric is better for multi‑item recommendations: hit‑rate or NDCG?,9b0e2d6a47
What steps should I follow to generate user queries from each dataset item for evaluation?,9b0e2d6a47
How do I choose the right chunk size for a large PDF collection?,6f2a8b3d10
Is it better to let an LLM decide where to split documents instead of fixed chunks?,6f2a8b3d10
Can I add a brief LLM‑generated summary to each chunk to improve retrieval?,6f2a8b3d10
What is the advantage of using a hybrid BM25 + dense retrieval for legal or financial PDFs?,6f2a8b3d10
Which Python libraries would help me convert my PDFs into clean Markdown before chunking?,6f2a8b3d10
How can I avoid accidentally committing my API keys to the repo?,e5d8a2c761
What exactly does reproducibility mean for the capstone project?,e5d8a2c761
Should I include a sample .env file and how should I set it up?,e5d8a2c761
"Do I need to provide the exact model used, or is a cheaper alternative acceptable?",e5d8a2c761
How can I ensure the reviewer can rebuild my search index without needing my credentials?,e5d8a2c761
Is it okay to submit my capstone project using Java instead of Python?,ea815eb858
What documentation is required if I write a homework assignment in R?,ea815eb858
Will using JavaScript for the project affect the grading process?,ea815eb858
Do I need to supply OS‑specific instructions when I use a non‑Python stack?,ea815eb858
Are there any limitations on using Go for the final project?,ea815eb858
Where can I view past LLM Zoomcamp capstone projects?,930286278d
How do I find examples of completed LLM Zoomcamp projects from 2024 and 2025?,930286278d
Is there a place to browse earlier LLM Zoomcamp project repositories?,930286278d
Where can I look at previous project submissions for guidance?,930286278d
Which URLs host past LLM Zoomcamp capstone projects?,930286278d
Is it mandatory to register my project idea before kicking off the capstone?,897a350476
Can I drop my idea into Slack to get quick feedback?,897a350476
Where can I find examples of past projects to see what scope looks like?,897a350476
Is it okay to pick a topic that’s similar to what others have done?,897a350476
Do I have to ensure my implementation is unique even if the topic repeats?,897a350476
Can I build my capstone as a WhatsApp bot instead of a web app?,7318a90b14
Do I have to use a web interface for the project?,7318a90b14
Is a CLI or a Jupyter notebook acceptable for the final project?,7318a90b14
Do I need to learn how to make a Slack app for my capstone?,7318a90b14
What evaluation criteria apply if I choose a non-web interface?,7318a90b14
Which libraries are best for extracting text from PDFs in a RAG workflow?,d8b28c47a0
How can I handle OCR for scanned PDFs when building a retrieval‑augmented model?,d8b28c47a0
What tools can I try for converting PDFs to Markdown for my RAG project?,d8b28c47a0
Is there an easy API‑based OCR solution I can use instead of running Tesseract locally?,d8b28c47a0
Can I use PyMuPDF for fast text extraction and then chunk the documents for RAG?,d8b28c47a0
Is it okay to reuse the workshop files in my own capstone?,d850a0e7ea
Can I share the workshop material with my classmates?,d850a0e7ea
Do I need permission to use these resources in other Zoomcamps?,d850a0e7ea
Is the content free to incorporate into personal projects?,d850a0e7ea
Can I distribute the workshop docs to external collaborators?,d850a0e7ea
What is the first command I should run to start a new dlt project when I’m working with cloud data sources?,6bceeebf04
How can I initialize a dlt project that uses a filesystem and DuckDB as the backend?,6bceeebf04
Where can I find a step‑by‑step guide to set up a dlt project for cloud ingestion?,6bceeebf04
"Does the dlt init command support cloud‑based ingestion, and if so, what arguments do I need to provide?",6bceeebf04
Which command do I use to create a new dlt project that works with cloud storage and DuckDB?,6bceeebf04
Why do I see a FileNotFoundError when opening notion_pages___homework?,0407213397
"What step do I miss before calling db.open_table(""notion_pages___homework"")?",0407213397
How can I properly rename employee_handbook to homework in my pipeline?,0407213397
Where exactly do I need to update the table name in my DLT settings?,0407213397
Do I have to use db.create_table if the table already exists?,0407213397
I get a FileNotFoundError: notion_pages___homework when I run main()—what’s wrong?,e95bfafc0e
How can I make db.create_table work for notion_pages___homework?,e95bfafc0e
Why does main() complain that notion_pages___homework doesn’t exist?,e95bfafc0e
What line should I check to open notion_pages___homework correctly?,e95bfafc0e
Is the error due to the table name in line 3 not matching what I created?,e95bfafc0e
Which command shows me every table in my database?,e394e6f738
Is there a way to list all tables using the dlt API?,e394e6f738
How do I get the names of all tables in the database?,e394e6f738
Can I retrieve all table names programmatically?,e394e6f738
What method do I call to see the tables present in the db?,e394e6f738
Does DLT currently support a connector for ClickHouse?,cd19f122f3
Is there any built‑in connector for StarRocks in DLT?,cd19f122f3
Can I contribute a new connector for ClickHouse to the DLT project?,cd19f122f3
What steps are required to add a StarRocks connector in DLT?,cd19f122f3
What is the current status of ClickHouse or StarRocks support in DLT?,cd19f122f3
How do I resolve the 401 Unauthorized error that appears when I run the Notion ingestion notebook?,0dfba07ace
What steps should I follow if my notebook cannot access the Notion API and I see a 401 status code?,0dfba07ace
Why does the notebook return a ‘Client Error: Unauthorized’ when calling the Notion endpoint?,0dfba07ace
My Notion API key is expiring—how can I regenerate it to keep the notebook authenticated?,0dfba07ace
What permissions or scopes are required on the Notion integration to let the notebook read data?,0dfba07ace
"My requests library keeps installing v2.28, but lancedb needs v2.32—how do I get the correct version?",4b30b918bc
Why is pip installing an older requests version than what's required for lancedb?,4b30b918bc
I’m getting a 401 error when using lancedb; could it be a requests version issue?,4b30b918bc
How can I manually install requests v2.32.3 for lancedb compatibility?,4b30b918bc
What’s the fix if my environment only has requests 2.28 but lancedb demands 2.32?,4b30b918bc
