question,document
Can I join the course now that it's already running?,74eb249bbf
How do I enroll if I discovered the course just now?,74eb249bbf
Will I be able to get a certificate if I sign up after the start date?,74eb249bbf
Do I need to finish and submit my project to receive a certificate?,74eb249bbf
What’s the deadline for project submission if I join late?,74eb249bbf
When will I get a confirmation email after registering for the LLM Zoomcamp?,977bf7786c
Do I need to wait for a confirmation email before starting the course?,977bf7786c
Can I start learning and submitting homework without a confirmation email?,977bf7786c
Is my registration verified against a list before the course begins?,977bf7786c
What happens if I register but don’t receive a confirmation email?,977bf7786c
How do I find the link to join the Office Hours live stream?,489dd1c9d9
Where is the YouTube live link usually posted before the session starts?,489dd1c9d9
Can I ask questions directly in the Zoom chat during the workshop?,489dd1c9d9
Which Telegram or Slack channel should I check for the session URL?,489dd1c9d9
Is there a way to submit questions if I miss the live Slido session?,489dd1c9d9
What are the first resources I should consult to start the LLM Zoomcamp?,04919992b3
Where can I find the weekly deadlines and overall course schedule?,04919992b3
"Is there a fixed start date for the course, or can I begin at any time?",04919992b3
What is the recommended workflow for completing a lesson and its homework?,04919992b3
Through which platform do I submit my homework assignments?,04919992b3
How do I locate my entry on the leaderboard?,c2903069a0
I can't find my name on the leaderboard – what am I missing?,c2903069a0
Can I change the random name that appears on my leaderboard entry?,c2903069a0
Is it allowed to use my Slack or GitHub username as my display name?,c2903069a0
Where do I update the official name that will appear on my certificate?,c2903069a0
Will I receive a certificate if I complete the course on my own schedule?,69d122f12e
Do self‑paced students get certificates after finishing the program?,69d122f12e
How does the certificate policy work for people who take the course independently?,69d122f12e
"Is a certificate only awarded to cohort participants, not self‑paced learners?",69d122f12e
What’s required to earn a certificate—must I be in a live cohort?,69d122f12e
Can I still receive a certificate if I didn't complete the initial assignment?,9f689c185f
How does skipping homework affect my ranking on the leaderboard?,9f689c185f
Is it necessary to finish every task before submitting the capstone?,9f689c185f
Will missing early work reduce my overall score?,9f689c185f
What role do assignment points play in determining my final position?,9f689c185f
When will the homework be finalized and stop changing?,96286b4be4
What does the [DRAFT] tag in the homework title indicate?,96286b4be4
Will the content of a homework change after the title loses the [DRAFT] tag?,96286b4be4
Is it risky to start working on homework that still has [DRAFT] in its title?,96286b4be4
How do I know that a homework is ready for submission?,96286b4be4
In which season will the next cohort start?,bd31146b0e
When is the next enrollment period for the course?,bd31146b0e
Do you have a schedule for the following offering?,bd31146b0e
What time of year does the course next run?,bd31146b0e
When should I expect the next session to begin?,bd31146b0e
Where can I watch the course lectures and videos?,31456f4b5f
Is there a YouTube playlist I can use for the Zoomcamp videos?,31456f4b5f
How do I find the video links for each lesson?,31456f4b5f
"Which source keeps the video links updated more reliably, GitHub or YouTube?",31456f4b5f
Are the lesson folders on GitHub the best place to locate the lecture videos?,31456f4b5f
Where can I find the syllabus and deadlines for the LLM Zoomcamp?,20c5a1347e
How do I keep track of my homework and progress in the course?,20c5a1347e
Is there a specific platform I should use to view the cohort schedule and assignments?,20c5a1347e
Where can I see the current course structure and upcoming deadlines?,20c5a1347e
Can I monitor my assignment status and overall progress through a single dashboard?,20c5a1347e
Do you hold live office hours for every module?,d65e05bd7a
Are there any live sessions available for the modules?,d65e05bd7a
How can I get help if I get stuck between modules?,d65e05bd7a
Is there a place where I can ask questions during the course?,d65e05bd7a
Does the course offer optional live support or office hours?,d65e05bd7a
How do Bluesky posts count toward my public learning credits?,dbf5369006
What qualifies a Bluesky post to be considered for public credits in the course?,dbf5369006
Can I reuse a Bluesky post for multiple learning credit entries?,dbf5369006
Do I need to include the course hashtag when posting to Bluesky for credit?,dbf5369006
Is there a limit to how many Bluesky posts I can submit for credits?,dbf5369006
How can I join the LLM Zoomcamp Telegram group?,054f3fd58f
What is the link to the official LLM Zoomcamp Telegram channel?,054f3fd58f
Is there a Telegram channel for the LLM Zoomcamp?,054f3fd58f
Where do I find announcements for LLM Zoomcamp?,054f3fd58f
Which platform do I use for technical discussions in the course?,054f3fd58f
Why does the FAQ count differ from what I saw in the course videos?,e2d595f23c
How often is the FAQ data updated after the videos were recorded?,e2d595f23c
Are new FAQs added and old ones removed over time?,e2d595f23c
When did the last update to the FAQ dataset occur relative to the videos?,e2d595f23c
Will the number of FAQs stay the same as shown in the videos?,e2d595f23c
Can I submit my homework after the deadline if the form is still open?,a9353fadfe
"If the deadline has passed, is it still okay to submit via the open form?",a9353fadfe
Will I be able to submit late assignments as long as the form hasn't closed?,a9353fadfe
What happens if the homework form closes after the deadline—can I still submit?,a9353fadfe
Is there a grace period for submitting assignments after the deadline if the form remains open?,a9353fadfe
Can I submit homework after the deadline has passed?,cdc3b285e5
Will I get a deadline extension for homework?,cdc3b285e5
What are the consequences of missing a homework deadline?,cdc3b285e5
Does missing a homework affect my certificate?,cdc3b285e5
How does a missed homework affect my leaderboard rank?,cdc3b285e5
Will the name I put on the certificate appear in the public leaderboard or on the website?,651ba06b34
Can I keep my real name hidden on the leaderboard while still having it on my certificate?,651ba06b34
What is the difference between my leaderboard nickname and the name printed on my certificate?,651ba06b34
How do I edit my public nickname and certificate name in the course profile?,651ba06b34
Will my certificate name ever be shared with third parties or appear on public pages?,651ba06b34
Why aren't we using a framework like LangChain in this course?,b7cdde6b25
"What’s the reason for building prompting, retrieval, indexing, and evaluation ourselves first?",b7cdde6b25
How does learning core components first help when later using tools like LangChain?,b7cdde6b25
Could you explain the analogy between building HTML/CSS/JS first and not using LangChain?,b7cdde6b25
Is it better to understand what LangChain automates before diving into it?,b7cdde6b25
What does the 'Insufficient credits' error mean when I run responses.create?,f5df151c59
How can I check if my OpenAI account has enough credits for RAG?,f5df151c59
Is there a way to avoid the credit error when using responses.create?,f5df151c59
What steps should I take after seeing the OpenAI API Error: Insufficient credits?,f5df151c59
Does the RAG module provide alternatives if my OpenAI credits run out?,f5df151c59
What does a RateLimitError 429 indicate in my OpenAI usage?,152af39a53
How do I add more credits to my OpenAI account?,152af39a53
Which models can I use once I've added credits to my account?,152af39a53
Do I need to recreate my API key after updating my billing?,152af39a53
Where can I find the OpenAI billing and plan details?,152af39a53
How much will I have to spend to use the Open AI API?,554d0eb78b
What is the minimum recharge amount I can make?,554d0eb78b
Are there any hidden costs or extra fees for using the OpenAI API?,554d0eb78b
Will I get charged on a monthly basis or per usage?,554d0eb78b
Is there any discount or free credits available for students?,554d0eb78b
Do I need to pay for the OpenAI API to complete the course?,85384a18e5
Is a subscription to OpenAI required for the course assignments?,85384a18e5
Can I use free or low-cost alternatives instead of the paid OpenAI API?,85384a18e5
Where can I find the list of OpenAI API alternatives for this course?,85384a18e5
Will the course assignments work without the official OpenAI API?,85384a18e5
What are the benefits of using uv over pip and virtualenv?,f81dea8f7e
"Is uv mandatory for the course, or can I still use pip and virtualenv?",f81dea8f7e
"How does uv replace tools like poetry, pyenv, and pipx?",f81dea8f7e
Where can I find documentation for uv?,f81dea8f7e
Does uv provide reproducible lockfiles for my project dependencies?,f81dea8f7e
How do I ensure my OPENAI_API_KEY is detected in the notebook?,86d99bbf21
What steps should I follow to load my API key in a Jupyter environment?,86d99bbf21
"If the notebook can’t find my key, how can I troubleshoot the environment variable?",86d99bbf21
Which library should I install to handle environment variables for OpenAI?,86d99bbf21
Where should I place the OPENAI_API_KEY in the project to avoid missing it?,86d99bbf21
How do I keep my OpenAI API key out of the repository and still use it in my scripts?,233dabe430
What's the proper way to load environment variables from a .env file when running a Python program?,233dabe430
"Is it necessary to add the .env file to .gitignore, and why should I?",233dabe430
"Do I have to install an extra package to read .env files in Python, and which one is it?",233dabe430
"Once I load the .env file, how can I access the OPENAI_API_KEY inside my code?",233dabe430
Is it okay to use a different model for the homework?,ee43413718
Can I switch to a different provider like Gemini or Azure OpenAI?,ee43413718
Do I need a paid service to complete the assignment?,ee43413718
Do I have to stick with the recommended model?,ee43413718
Will I need to modify the code if I use a different provider?,ee43413718
Where should I store my Gemini API key so the notebook can read it?,0ae5c221b9
How do I set up the OpenAI client to point to Google’s Gemini endpoint?,0ae5c221b9
Which model name do I pass when calling the Gemini API?,0ae5c221b9
Can I use the provided `llm` helper in the Module 1 notebook?,0ae5c221b9
Will I need to edit the notebook for function calls when using Gemini?,0ae5c221b9
How can I use Gemini via the OpenAI‑compatible endpoint and still get Pydantic‑parsed output?,341f71f28c
What does the Pydantic model definition look like for a Gemini response with question/answer fields?,341f71f28c
"Can I keep using the OpenAI SDK while calling a Gemini model, and if so, how?",341f71f28c
When should I choose chat.completions.parse over the newer Responses API?,341f71f28c
What extra libraries do I need to install to run chat.completions.parse with Gemini?,341f71f28c
How do I install Ollama on my computer?,1d0b969028
What steps do I need to take to get the LLaMA 3 model running locally?,1d0b969028
"After installing Ollama, how can I verify that the local server is up and responding?",1d0b969028
Which command should I run to install the Ollama Python client?,1d0b969028
Can you provide a short Python script that demonstrates sending a prompt to Ollama and printing the response?,1d0b969028
How can I resolve a connection refused error when I prompt Ollama during the RAG module?,c6fc2d4d11
What steps should I take if Ollama keeps refusing connections while I run the homework?,c6fc2d4d11
"Why does the notebook sometimes show a connection error with Ollama, and how do I fix it?",c6fc2d4d11
Is there a way to restart Ollama automatically when I hit a connection refused issue?,c6fc2d4d11
What command do I use to bring the Ollama server back online after a crash?,c6fc2d4d11
Why does the token count from tiktoken differ from OpenAI's reported count?,bf0403d21b
How many structural tokens does each message add in chat.completions.create()?,bf0403d21b
What additional tokens are added globally for the assistant response?,bf0403d21b
Do newlines or special Unicode characters affect token counting?,bf0403d21b
Can I get a reliable token estimate before making the API call?,bf0403d21b
How can I set API keys globally so they load automatically in my terminal sessions?,8b2f5e9d04
What tool can I use to load environment variables when I cd into my project?,8b2f5e9d04
Is there a way to keep my .env files out of GitHub while using Codespaces?,8b2f5e9d04
How do I use dirdotenv with my shell configuration?,8b2f5e9d04
Can I use python-dotenv to load API keys in my scripts?,8b2f5e9d04
What’s the best way to pick field weights in a search engine?,87d4ea4e08
How can I evaluate different field weight settings?,87d4ea4e08
Why do I need a ground-truth dataset for tuning field weights?,87d4ea4e08
What metrics should I look at when testing field weights?,87d4ea4e08
Is there a simpler method than trial and error for choosing weights?,87d4ea4e08
What are the main steps to clean and structure data before using it in a Retrieval Augmented Generation workflow?,649c280e6d
Which kinds of noise should I remove from documents for better RAG performance?,649c280e6d
"Why is it important to keep metadata like titles, dates, and speaker names when preparing RAG sources?",649c280e6d
How should I chunk documents so that related context stays together for RAG?,649c280e6d
"Is JSON the best format for storing RAG data, or can I use other formats?",649c280e6d
What does the 'Failed to hardlink files' warning indicate in Codespaces?,acf8fa5356
Is that warning actually an error that stops the installation?,acf8fa5356
How can I tell uv to copy files instead of hardlinking?,acf8fa5356
How do I make the copy mode persist across shell sessions?,acf8fa5356
Where can I read more about uv's link mode options?,acf8fa5356
Why is dotenv not recognized in my Python project?,0bed1f48da
Which package should I install to use load_dotenv?,0bed1f48da
How can I add python-dotenv to my environment using uv?,0bed1f48da
What is the proper way to import and invoke load_dotenv in code?,0bed1f48da
Where can I view the official documentation for python-dotenv?,0bed1f48da
Can I complete the course on my own computer instead of using Codespaces?,aa310de435
Which software must I install to run the course locally?,aa310de435
What is the recommended procedure for setting up the course environment on my machine?,aa310de435
How can I make sure my local environment stays consistent with the course requirements?,aa310de435
Are there any common pitfalls when running the course outside of Codespaces?,aa310de435
What happens to my code if I don't commit it in Codespaces?,610ccb23c0
Will my work be lost if I don't save it?,610ccb23c0
How can I ensure my Codespaces code is backed up?,610ccb23c0
Can I recover my code after a Codespace is deleted?,610ccb23c0
What's the best practice for saving code in Codespaces?,610ccb23c0
"If my computer has more than 8 GB of RAM, how can I make WSL2 use all of it instead of just 8 GB?",f3dd94f323
What is the correct location and format for the .wslconfig file to increase WSL2 memory?,f3dd94f323
"After editing the .wslconfig file, how do I apply the new memory limit to my WSL2 instance?",f3dd94f323
How can I check the current memory allocation for WSL2 to confirm it has changed?,f3dd94f323
Is there a recommended resource or tutorial that walks through setting WSL2 memory limits?,f3dd94f323
"What should I do if my GitHub Codespace gets stuck on the ""Finishing up"" screen and won't reconnect?",830f3d2018
How can I recover my project if I lose my setup after stopping or restarting my Codespace?,830f3d2018
"Can I open my Codespace in a web browser instead of VS Code to get past the ""Finishing up"" problem?",830f3d2018
"After creating a brand-new Codespace, what's the quickest way to reinstall all dependencies?",830f3d2018
How often should I commit and push my work to avoid data loss if my Codespace is deleted?,830f3d2018
Can I use a different LLM provider instead of OpenAI for the course?,c6ff9083c0
How do I switch the course code to another provider like Groq or Gemini?,c6ff9083c0
Is it possible to run a model locally with Ollama or vLLM without an external API key?,c6ff9083c0
What steps should I follow if I want to use a hosted OpenAI‑compatible provider like OpenRouter?,c6ff9083c0
Do I need to keep a GPU instance running if I rent a machine to serve the model?,c6ff9083c0
What can I do if I keep getting 429 errors from OpenAI during the course?,8e21752415
How can I reduce the number of API calls to stay under the rate limits?,8e21752415
Is there a way to automatically retry a call when I hit a rate limit?,8e21752415
"Should I lower the thread pool size, and how many workers are safe?",8e21752415
Can I cache embeddings or LLM results locally to avoid repeated requests?,8e21752415
How do tools or functions work in agentic RAG compared to regular RAG?,c296ea5a21
When can a model decide to use a tool or function during agentic RAG?,c296ea5a21
What are some examples of external services a tool or function could call in this course?,c296ea5a21
Does agentic RAG change the order of retrieval and answering steps compared to basic RAG?,c296ea5a21
Are there any naming conventions I should know when using tools versus functions?,c296ea5a21
Are there any free models that support tool use?,0d74a3616f
"Which free Groq models offer tool usage, like Deepseek R1 or Llama 4?",0d74a3616f
Can I use Gemini or Mistral for function calling without paying?,0d74a3616f
Is it possible to enable tool calling on local Ollama models?,0d74a3616f
Do I need to adjust the code when switching from OpenAI to another provider?,0d74a3616f
What causes the AttributeError when I call `response.output` with a non-OpenAI model?,9e7b3f0c25
How do I extract the assistant's reply from a non-OpenAI provider's response?,9e7b3f0c25
Is there a way to use the new Responses API with providers like Mistral or Gemini?,9e7b3f0c25
What changes do I need to make to the tools schema for a different provider?,9e7b3f0c25
When should I use the older chat.completions API instead of the Responses API?,9e7b3f0c25
How do I fix the 400 error complaining about missing 'tools[0].function' when using Azure OpenAI?,b9c7c6bb34
What does the error 'Missing required parameter: tools[0].function' mean and how can I solve it?,b9c7c6bb34
How should I modify my get_weather_tool JSON for Azure OpenAI?,b9c7c6bb34
Can I use function calling with Azure OpenAI if I add a 'function' key?,b9c7c6bb34
Is the updated get_weather_tool JSON compatible with Azure OpenAI function calling?,b9c7c6bb34
How can I run toyaikit with Groq instead of OpenAI?,0224d980b3
What causes the 404 error when using Groq with toyaikit?,0224d980b3
How do I switch to Anthropic in toyaikit?,0224d980b3
Which toyaikit classes should I use for chat completions with Groq?,0224d980b3
Do I need to specify the model ID for Anthropic in toyaikit?,0224d980b3
Where are the Module 1 homework links?,53f15299b6
How can I access the Module 1 homework instructions on GitHub?,53f15299b6
Which platform should I use to see the deadlines for Module 1 homework?,53f15299b6
Does the course platform provide extra context for the Module 1 homework?,53f15299b6
Can I submit my Module 1 homework through the course management platform?,53f15299b6
Why am I getting an empty list after I run my filter query in Homework 3?,83da208a64
What could cause the filtered results to return nothing during the LLM Zoomcamp homework?,83da208a64
Does indexing need to be set up before adding data to solve the empty list problem?,83da208a64
How do I add index settings properly to avoid empty query results?,83da208a64
Is it a common issue to get no results when filtering after data insertion in this course?,83da208a64
Why am I seeing a 402 error when I call responses.create on OpenRouter?,cfb07a27d5
What does the 402 error mean and how can I fix it on OpenRouter?,cfb07a27d5
How can I set max_output_tokens to avoid the 402 error in my LLM code?,cfb07a27d5
Is the 402 error different from the typical 429 error from OpenAI?,cfb07a27d5
What should I check if I keep getting 402 after setting max_output_tokens?,cfb07a27d5
Why should I build the index on chunked documents instead of full documents for RAG?,b4300adeb1
How does feeding only relevant chunks into the prompt reduce model context?,b4300adeb1
What happens if I mistakenly fit the index on the original full documents?,b4300adeb1
Can I still use the original documents in the RAG pipeline after chunking?,b4300adeb1
How does the RAG pipeline retrieve and insert only the relevant chunks into the prompt?,b4300adeb1
"If my numeric answer is close but not exactly one of the listed options, should I still pick the nearest one?",5e4ca64cb5
What are the common causes for my homework answer to differ slightly from the provided choices?,5e4ca64cb5
"If my answer is far from all options, what steps should I take to troubleshoot?",5e4ca64cb5
Does the homework allow me to use a different dataset version that might change the options?,5e4ca64cb5
Where can I find the overall guidelines for handling homework answer mismatches?,5e4ca64cb5
Where can I find the detailed homework instructions for Module 1?,7d3a2e3505
"If the homework tasks are still confusing after reading the GitHub files, what should I do next?",7d3a2e3505
What’s the best way to share my code or command output when asking for help on Slack?,7d3a2e3505
Are there any guidelines I should follow before posting a question about homework?,7d3a2e3505
Where does the lesson workflow differ from the homework assignments?,7d3a2e3505
What is the best way to find token counts for Module 1 homework when using a provider other than OpenAI?,fe8fed31e6
Can I use tiktoken for token counting with Gemini or other non‑OpenAI models?,fe8fed31e6
Where can I locate the usage fields in the response object of my provider?,fe8fed31e6
How should I adapt the code if my provider doesn’t expose token usage?,fe8fed31e6
Which provider’s native tokenizer should I use if my API doesn’t provide usage metrics?,fe8fed31e6
"My GitHub repo shows up fine, yet the homework submission says it can't be fetched—what's going on?",bcdb8740ce
I keep getting a 500 error when submitting my repo URL; how can I resolve this?,bcdb8740ce
Does including '.git' at the end of my repository link break the homework checker?,bcdb8740ce
How can I verify that my repo link will be reachable by the submission system before I submit?,bcdb8740ce
Could a simple typo in my repository URL be the reason for a non‑200 response?,bcdb8740ce
How do embeddings translate text into numeric vectors without losing meaning?,69430a79a8
Why do similar pieces of data result in close numbers when embedded?,69430a79a8
What role does vector proximity play in measuring semantic similarity?,69430a79a8
How is the vector space model linked to the concept of embeddings?,69430a79a8
Can you explain the relationship between dimensionality reduction and embeddings?,69430a79a8
I keep seeing a warning about the sentence‑transformers model version. How can I get rid of it?,aa3f597424
Which pip command will upgrade sentence‑transformers to the required version?,aa3f597424
What does the warning about 'multi‑qa‑mpnet‑base‑dot‑v1' actually mean?,aa3f597424
Will ignoring the warning hurt my vector search results?,aa3f597424
"If upgrading is not possible, is there a way to silence the warning?",aa3f597424
Why did the lesson use `.dot(...)` directly for cosine similarity?,92cd22cada
Why does the homework emphasize vector normalization before dot product?,92cd22cada
Are embeddings from OpenAI already normalized to unit length?,92cd22cada
What happens if we use non‑normalized embeddings in a dot product?,92cd22cada
How can I normalize my TF‑IDF + SVD embeddings to compute cosine similarity?,92cd22cada
"How do I decide whether to embed only the question, only the answer, or both in a vector search setup?",5c4a8d2e60
Why is embedding the question alone often recommended?,5c4a8d2e60
What are the trade‑offs between embedding just the answer and concatenating question and answer?,5c4a8d2e60
Can I use MRR on my ground‑truth set to choose the best embedding strategy?,5c4a8d2e60
Where can I find the side‑by‑side comparison of these options in the course materials?,5c4a8d2e60
What does cosine similarity measure?,db78580409
How does cosine similarity relate to document similarity?,db78580409
What is the range of cosine similarity values?,db78580409
When is cosine similarity equal to 1?,db78580409
Can cosine similarity be negative?,db78580409
How does normalizing vectors to unit length make cosine similarity just a dot product?,95feb4e75b
Why do we drop magnitude when computing similarity between a query and document embeddings?,95feb4e75b
What happens to cosine similarity when all vectors are unit‑length? Is it still a dot product?,95feb4e75b
How does converting cosine similarity to a dot product help speed up the search?,95feb4e75b
Can you explain why matrix multiplication works for cosine similarity once vectors are normalized?,95feb4e75b
Do I need a brand‑new GitHub repository for the vector‑search module or can I just spin up a new codespace from my existing repo?,1e829a8c6f
Why should I create a separate codespace for the vector‑search part of the course?,1e829a8c6f
What happens to my code if I delete the codespace—will I lose my work?,1e829a8c6f
